Assay_Name,Target,Cell_Model,Readout,Relevant_Drug,Evidence_from_Data,Feasibility,Priority,Notes
Canine Th2 Cytokine Release (PBMC),"IL-31, IL-4, IL-13",Canine PBMCs stimulated with anti-CD3/CD28 + IL-4,"ELISA / MSD multiplex: IL-31, IL-4, IL-13 in supernatant","Befrena (anti-IL31), Zenrelia (JAK1i)",IL-31/JAK/STAT pathway upregulated in AD blood; normalizes with ASIT,HIGH,1,Canine PBMCs commercially available (Bioreclamation IVT). IL-31 ELISA kits exist for dogs.
JAK1 Biochemical Kinase Assay,JAK1,Recombinant human/canine JAK1 protein (>97% identity),ADP-Glo luminescence or TR-FRET; IC50 measurement,Zenrelia (ilunocitinib = JAK1/JAK3 inhibitor),JAK1/STAT3/STAT6 are highly conserved (96-99% AA identity),HIGH,1,Human JAK1 protein valid surrogate given 97% identity. Selectivity profiling vs JAK2/3/TYK2 required.
STAT6 Phosphorylation Reporter (IL-4 Stimulation),STAT6 / IL-4R pathway,Canine DH82 macrophage cell line or PBMC-derived T cells,pSTAT6 (Y641) flow cytometry or AlphaLISA,Zenrelia (downstream of IL-4 → JAK1 → STAT6),STAT6 among most conserved STATs (96%); key Th2 transcription activator,HIGH,1,DH82 cells are a well-characterized canine macrophage line (ATCC CRL-10389). IL-4-stimulated pSTAT6 is a clean assay for JAK1i selectivity.
JAK Selectivity Profiling Panel,"JAK1, JAK2, JAK3, TYK2",Biochemical (recombinant proteins) + Ba/F3 cellular panel,IC50 matrix: 4 JAKs x N compounds; selectivity index calculation,Zenrelia selectivity optimization; new JAK inhibitor discovery,All 4 JAKs >91% conserved between dog and human; human proteins valid surrogates,HIGH,1,JAK1 vs JAK2 selectivity critical: JAK2 inhibition causes anemia/neutropenia. Selectivity >10x JAK1/JAK2 is the bar.
Multiplex Cytokine Profiling (Th2/Th1 Balance),"IL-31, IL-4, IL-13, IL-5, IFNg, TNF, TSLP",Canine PBMCs with allergen re-stimulation (house dust mite antigen),Luminex / MSD multiplex panel; cytokine concentrations,Multiple pipeline targets; used as PD biomarker,Blood transcriptomics shows Th2 skewing in AD; allergen-specific responses measurable ex vivo,HIGH,1,"Canine-specific cytokine kits available from R&D Systems, Meso Scale Discovery. Used in veterinary clinical trials."
IL-31-Induced STAT3 Activation Assay,IL-31RA / OSMR / JAK1 / STAT3,Canine DRG neurons (primary) or HEK293 overexpressing canine IL31RA/OSMR,pSTAT3 (Y705) ELISA or reporter gene (STAT3-luciferase),Befrena (neutralizes IL-31) AND Zenrelia (blocks JAK downstream),IL31RA/OSMR expressed in neural tissues; 74-82% dog/human identity allows human cells as partial surrogate,MEDIUM,2,Primary canine DRG neurons are challenging. STAT3-luc reporter in HEK293 + canine IL31RA overexpression is a practical alternative.
Anti-IL31 Neutralization Bioassay (for Befrena),IL-31 / IL31RA signaling,BaF3 cells stably expressing canine IL31RA + OSMR (engineered cell line),IL-31-driven cell proliferation (CTG); IC50 of antibody neutralization,Befrena (tirnovetmab) and any future anti-IL31 biologics,IL-31 is the primary pruritogen in CAD; 74% identity means canine-specific mAb needed,MEDIUM,2,BaF3 proliferation assay is standard for cytokine-mAb neutralization. Requires stable transfection of canine IL31RA. Key assay for Elanco's biologic platform.
Canine Keratinocyte Barrier Disruption Assay,Skin barrier / S100A8 / inflammatory signaling,Canine keratinocyte cell line (CPEK - Canine Primary Epidermal Keratinocyte),TEER (transepithelial resistance) + S100A8/A9 ELISA,Broad relevance to AD; shows barrier-inflammation link,S100A8/S100A9 elevated in canine AD; skin barrier disruption drives disease cycle,MEDIUM,2,CPEK cells available from commercial suppliers. Relevant for understanding FLG-independent barrier dysfunction.
